{
  "schema_version": "2.0.0",
  "analysis_id": "123e4567-e89b-12d3-a456-426614174000",
  "generated_at": "2026-02-03T12:00:00Z",
  "prompt_hash": "a1b2c3d4e5f6a1b2c3d4e5f6a1b2c3d4e5f6a1b2c3d4e5f6a1b2c3d4e5f6a1b2",
  "model_version": "gemini-3-pro-preview",
  "policy_wordings_checksum": "f6e5d4c3b2a1f6e5d4c3b2a1f6e5d4c3b2a1f6e5d4c3b2a1f6e5d4c3b2a1f6e5"
}